{
  "stgy_name": "SuperWinningSessionPoweredByMACrossOver_Day",
  "module_name": "SuperWinningSessionStrategy",
  "pt_exec" : true,
  "bt_start": "2018-10-01T08:59:00",
  "bt_end": "2022-11-25T08:59:00",
  "markets": ["KRW-BTC", "KRW-ETH"],
  "cdl_type": 60,
  "init_balance": 10000000,
  "slippage" : 0.005,
  "bt_times" : ["07:59", "08:59"],
  "vola": {
    "support": true,
    "vol_tgt": 0.04
  },
  "timeframe":{
    "support": false,
    "timeframes": ["7:59", "8:59"],
    "timegap": 1
  },
  "fixed": {
    "support": false,
    "hdge": true,
    "trade_ratio": 0.4
  },
  "weighted": {
    "support": false,
    "top_n": [0.6,0.3,0.1]
  },
  "stop_loss": {
    "support": false,
    "ratio": -0.04
  },
  "trailing_stop": {
    "support": false,
    "ratio": -0.02
  },
  "take_profit": {
    "support": false,
    "ratio": 0.07
  },
  "vars": {
    "base_time" : "08:59",
    "sell_time" : "07:59",
    "ma1": {"func": "sma", "params": [3], "cdl_type": 1440, "sources": ["close"], "unary": true},
    "ma2": {"func": "sma", "params": [5], "cdl_type": 1440, "sources": ["close"], "unary": true},
    "ma3": {"func": "sma", "params": [10], "cdl_type": 1440, "sources": ["close"], "unary": true},
    "ma4": {"func": "sma", "params": [20], "cdl_type": 1440, "sources": ["close"], "unary": true
    }},
  "buy_systems": {
    "system1": {"alias": "time", "left": "time", "op": "==", "right": "base_time"},
    "system2": {"alias": "ma1", "left": "close", "pt_left_market" : "KRW-BTC", "op": ">", "right": "ma1","pt_right_market" :  "KRW-BTC", "pt_tgt_market" :  "KRW-ETH"},
    "system3": {"alias": "ma2", "left": "close", "pt_left_market" : "KRW-BTC", "op": ">", "right": "ma2","pt_right_market" :  "KRW-BTC", "pt_tgt_market" :  "KRW-ETH"},
    "system4": {"alias": "ma3", "left": "close", "pt_left_market" : "KRW-BTC", "op": ">", "right": "ma3","pt_right_market" :  "KRW-BTC", "pt_tgt_market" :  "KRW-ETH"},
    "system5": {"alias": "ma4", "left": "close", "pt_left_market" : "KRW-BTC", "op": ">", "right": "ma4","pt_right_market" :  "KRW-BTC", "pt_tgt_market" :  "KRW-ETH"},
    "system6": {"alias": "crossover", "left": "ma2", "pt_left_market" : "KRW-BTC", "op": ">", "right": "ma4","pt_right_market" :  "KRW-BTC", "pt_tgt_market" :  "KRW-ETH"},
    "system7": {"alias": "ma1", "left": "close", "pt_left_market" : "KRW-ETH", "op": ">", "right": "ma1","pt_right_market" :  "KRW-ETH", "pt_tgt_market" :  "KRW-BTC"},
    "system8": {"alias": "ma2", "left": "close", "pt_left_market" : "KRW-ETH", "op": ">", "right": "ma2","pt_right_market" :  "KRW-ETH", "pt_tgt_market" :  "KRW-BTC"},
    "system9": {"alias": "ma3", "left": "close", "pt_left_market" : "KRW-ETH", "op": ">", "right": "ma3","pt_right_market" :  "KRW-ETH", "pt_tgt_market" :  "KRW-BTC"},
    "system10": {"alias": "ma4", "left": "close", "pt_left_market" : "KRW-ETH", "op": ">", "right": "ma4","pt_right_market" :  "KRW-ETH", "pt_tgt_market" :  "KRW-BTC"},
    "system11": {"alias": "crossover", "left": "ma2", "pt_left_market" : "KRW-ETH", "op": ">", "right": "ma4","pt_right_market" :  "KRW-ETH", "pt_tgt_market" :  "KRW-BTC"}
  },
  "buy_system_op": "system1 and ((system2 and system3 and system4 and system5 and system6) or (system7 and system8 and system9 and system10 and system11))",
  "sell_systems": {
    "system1": {"alias": "time", "left": "time", "op": "==", "right": "sell_time"},
    "system2": {"alias": "ma1", "left": "close", "pt_left_market" : "KRW-BTC", "op": "<", "right": "ma1","pt_right_market" :  "KRW-BTC", "pt_tgt_market" :  "KRW-ETH"},
    "system3": {"alias": "ma2", "left": "close", "pt_left_market" : "KRW-BTC", "op": "<", "right": "ma2","pt_right_market" :  "KRW-BTC", "pt_tgt_market" :  "KRW-ETH"},
    "system4": {"alias": "ma3", "left": "close", "pt_left_market" : "KRW-BTC", "op": "<", "right": "ma3","pt_right_market" :  "KRW-BTC", "pt_tgt_market" :  "KRW-ETH"},
    "system5": {"alias": "ma4", "left": "close", "pt_left_market" : "KRW-BTC", "op": "<", "right": "ma4","pt_right_market" :  "KRW-BTC", "pt_tgt_market" :  "KRW-ETH"},
    "system6": {"alias": "crossover", "left": "ma2", "pt_left_market" : "KRW-BTC", "op": "<", "right": "ma4","pt_right_market" :  "KRW-BTC", "pt_tgt_market" :  "KRW-ETH"},
    "system7": {"alias": "ma1", "left": "close", "pt_left_market" : "KRW-ETH", "op": "<", "right": "ma1","pt_right_market" :  "KRW-ETH", "pt_tgt_market" :  "KRW-BTC"},
    "system8": {"alias": "ma2", "left": "close", "pt_left_market" : "KRW-ETH", "op": "<", "right": "ma2","pt_right_market" :  "KRW-ETH", "pt_tgt_market" :  "KRW-BTC"},
    "system9": {"alias": "ma3", "left": "close", "pt_left_market" : "KRW-ETH", "op": "<", "right": "ma3","pt_right_market" :  "KRW-ETH", "pt_tgt_market" :  "KRW-BTC"},
    "system10": {"alias": "ma4", "left": "close", "pt_left_market" : "KRW-ETH", "op": "<", "right": "ma4","pt_right_market" :  "KRW-ETH", "pt_tgt_market" :  "KRW-BTC"},
    "system11": {"alias": "crossover", "left": "ma2", "pt_left_market" : "KRW-ETH", "op": "<", "right": "ma4","pt_right_market" :  "KRW-ETH", "pt_tgt_market" :  "KRW-BTC"}
  },
  "sell_system_op": "system1 and ((system2 or system3 or system4 or system5 or system6) or (system7 or system8 or system9 or system10 or system11))"
}