{
  "stgy_name": "SuperWinningSession_TAI_Hedge",
  "module_name": "SuperWinningSessionStrategy",
  "pt_exec" : true,
  "bt_start": "2023-01-24T08:59:00",
  "bt_end": "2023-05-14T08:59:00",
  "markets": ["KRW-BTC", "KRW-ETH", "KRW-XRP"],
  "cdl_type": 60,
  "init_balance": 10000000,
  "slippage" : 0.005,
  "bt_times" : ["08:59", "17:59"],
  "vola": {
    "support": true,
    "vol_tgt": 0.04
  },
  "timeframe":{
    "support": true,
    "timeframes": ["08:59", "17:59"],
    "timegap": 1
  },
  "fixed": {
    "support": false,
    "hdge": true,
    "trade_ratio": 0.4
  },
  "weighted": {
    "support": false,
    "top_n": [0.6,0.3,0.1]
  },
  "stop_loss": {
    "support": false,
    "ratio": -0.04
  },
  "trailing_stop": {
    "support": false,
    "ratio": -0.02
  },
  "take_profit": {
    "support": false,
    "ratio": 0.07
  },
  "vars": {
    "ma1": {"func": "sma", "params": [3], "cdl_type": 1474, "sources": ["close"], "unary": true},
    "ma2": {"func": "sma", "params": [5], "cdl_type": 1474, "sources": ["close"], "unary": true},
    "ma3": {"func": "sma", "params": [10], "cdl_type": 1474, "sources": ["close"], "unary": true},
    "ma4": {"func": "sma", "params": [20], "cdl_type": 1474, "sources": ["close"], "unary": true},
    "macd": {"func": "macd", "params": [12, 26, 9], "cdl_type": 1474, "sources": ["close"], "unary": false},
    "cci": {"func": "cci", "params": [], "cdl_type": 1474, "sources": ["high", "low", "close"], "unary": true},
    "bb": {"func": "bbands", "params": [20, 4.0, 2.0, 0], "cdl_type": 1474, "sources": ["close"], "unary": false}
  },
  "buy_systems": {
    "system1": {"alias": "ma1", "left": "close", "pt_left_market" : "KRW-BTC" ,"op": ">", "right": "ma1","pt_right_market" :  "KRW-BTC", "pt_tgt_market" :  "KRW-ETH"},
    "system2": {"alias": "ma2", "left": "close", "pt_left_market" : "KRW-BTC" ,"op": ">", "right": "ma2","pt_right_market" :  "KRW-BTC", "pt_tgt_market" :  "KRW-ETH"},
    "system3": {"alias": "ma3", "left": "close", "pt_left_market" : "KRW-BTC" ,"op": ">", "right": "ma3","pt_right_market" :  "KRW-BTC", "pt_tgt_market" :  "KRW-ETH"},
    "system4": {"alias": "ma4", "left": "close", "pt_left_market" : "KRW-BTC" ,"op": ">", "right": "ma4","pt_right_market" :  "KRW-BTC", "pt_tgt_market" :  "KRW-ETH"},
    "system5": {"alias": "macd", "left": "macd[0]", "pt_left_market" : "KRW-BTC" ,"op": ">", "right": "macd[1]","pt_right_market" : "KRW-BTC", "pt_tgt_market" : "KRW-ETH"},
    "system6": {"alias": "cci", "left": "cci", "pt_left_market" : "KRW-BTC" ,"op": ">", "right": "0","pt_right_market" :  "KRW-BTC", "pt_tgt_market" :  "KRW-ETH"},
    "system7": {"alias": "bb", "left": "close", "pt_left_market" : "KRW-BTC" ,"op": ">", "right": "bb[2]", "pt_right_market" :  "KRW-BTC", "pt_tgt_market" :  "KRW-ETH"},
    "system8": {"alias": "ma1", "left": "close", "pt_left_market" : "KRW-ETH" ,"op": ">", "right": "ma1","pt_right_market" :  "KRW-ETH", "pt_tgt_market" :  "KRW-XRP"},
    "system9": {"alias": "ma2", "left": "close", "pt_left_market" : "KRW-ETH" ,"op": ">", "right": "ma2","pt_right_market" :  "KRW-ETH", "pt_tgt_market" :  "KRW-XRP"},
    "system10": {"alias": "ma3", "left": "close", "pt_left_market" : "KRW-ETH" ,"op": ">", "right": "ma3","pt_right_market" :  "KRW-ETH", "pt_tgt_market" :  "KRW-XRP"},
    "system11": {"alias": "ma4", "left": "close", "pt_left_market" : "KRW-ETH" ,"op": ">", "right": "ma4","pt_right_market" :  "KRW-ETH", "pt_tgt_market" :  "KRW-XRP"},
    "system12": {"alias": "macd", "left": "macd[0]", "pt_left_market" : "KRW-ETH" ,"op": ">", "right": "macd[1]","pt_right_market" : "KRW-ETH", "pt_tgt_market" : "KRW-XRP"},
    "system13": {"alias": "cci", "left": "cci", "pt_left_market" : "KRW-ETH" ,"op": ">", "right": "0","pt_right_market" :  "KRW-ETH", "pt_tgt_market" :  "KRW-XRP"},
    "system14": {"alias": "bb", "left": "close", "pt_left_market" : "KRW-ETH" ,"op": ">", "right": "bb[2]", "pt_right_market" :  "KRW-ETH", "pt_tgt_market" :  "KRW-XRP"}
  },
  "buy_system_op": "(system1 and system2 and system3 and system4 and system5 and system6 and system7) or (system8 and system9 and system10 and system11 and system12 and system13 and system14)",
  "sell_systems": {
    "system1": {"alias": "ma1", "left": "close", "pt_left_market" : "KRW-BTC" ,"op": "<", "right": "ma1","pt_right_market" :  "KRW-BTC", "pt_tgt_market" :  "KRW-ETH"},
    "system2": {"alias": "ma2", "left": "close", "pt_left_market" : "KRW-BTC" ,"op": "<", "right": "ma2","pt_right_market" :  "KRW-BTC", "pt_tgt_market" :  "KRW-ETH"},
    "system3": {"alias": "ma3", "left": "close", "pt_left_market" : "KRW-BTC" ,"op": "<", "right": "ma3","pt_right_market" :  "KRW-BTC", "pt_tgt_market" :  "KRW-ETH"},
    "system4": {"alias": "ma4", "left": "close", "pt_left_market" : "KRW-BTC" ,"op": "<", "right": "ma4","pt_right_market" :  "KRW-BTC", "pt_tgt_market" :  "KRW-ETH"},
    "system5": {"alias": "macd", "left": "macd[0]", "pt_left_market" : "KRW-BTC" ,"op": "<", "right": "macd[1]","pt_right_market" :  "KRW-BTC", "pt_tgt_market" :  "KRW-ETH"},
    "system6": {"alias": "cci", "left": "cci", "pt_left_market" : "KRW-BTC" ,"op": "<", "right": "0","pt_right_market" :  "KRW-BTC", "pt_tgt_market" :  "KRW-ETH"},
    "system7": {"alias": "bb", "left": "close", "pt_left_market" : "KRW-BTC" ,"op": ">", "right": "bb[0]","pt_right_market" :  "KRW-BTC", "pt_tgt_market" :  "KRW-ETH"},
    "system8": {"alias": "ma1", "left": "close", "pt_left_market" : "KRW-ETH" ,"op": "<", "right": "ma1","pt_right_market" :  "KRW-ETH", "pt_tgt_market" :  "KRW-XRP"},
    "system9": {"alias": "ma2", "left": "close", "pt_left_market" : "KRW-ETH" ,"op": "<", "right": "ma2","pt_right_market" :  "KRW-ETH", "pt_tgt_market" :  "KRW-XRP"},
    "system10": {"alias": "ma3", "left": "close", "pt_left_market" : "KRW-ETH" ,"op": "<", "right": "ma3","pt_right_market" :  "KRW-ETH", "pt_tgt_market" :  "KRW-XRP"},
    "system11": {"alias": "ma4", "left": "close", "pt_left_market" : "KRW-ETH" ,"op": "<", "right": "ma4","pt_right_market" :  "KRW-ETH", "pt_tgt_market" :  "KRW-XRP"},
    "system12": {"alias": "macd", "left": "macd[0]", "pt_left_market" : "KRW-ETH" ,"op": "<", "right": "macd[1]","pt_right_market" : "KRW-ETH", "pt_tgt_market" : "KRW-XRP"},
    "system13": {"alias": "cci", "left": "cci", "pt_left_market" : "KRW-ETH" ,"op": "<", "right": "0","pt_right_market" :  "KRW-ETH", "pt_tgt_market" :  "KRW-XRP"},
    "system14": {"alias": "bb", "left": "close", "pt_left_market" : "KRW-ETH" ,"op": ">", "right": "bb[0]", "pt_right_market" :  "KRW-ETH", "pt_tgt_market" :  "KRW-XRP"}
  },
  "sell_system_op": "(system1 or system2 or system3 or system4 or system5 or system6 or system7) or (system8 or system9 or system10 or system11 or system12 or system13 or system14)"
}