{
  "stgy_name": "SWKimStrategy1_Hdge",
  "module_name": "SWKimStrategy",
  "pt_exec" : true,
  "bt_start": "2018-10-01T08:59:00",
  "bt_end": "2022-11-25T08:59:00",
  "markets": ["KRW-BTC", "KRW-ETH", "KRW-XRP"],
  "cdl_type": 60,
  "init_balance": 10000000,
  "slippage" : 0.005,
  "bt_times" : ["07:59","08:59", "15:59","16:59"],
  "vola": {
    "support": true,
    "vol_tgt": 0.02
  },
  "timeframe":{
    "support": true,
    "timeframes": ["08:59", "16:59"],
    "timegap": 1
  },
  "fixed": {
    "support": false,
    "hdge": false,
    "trade_ratio": 0.4
  },
  "weighted": {
    "support": false,
    "top_n": [0.6,0.3,0.1]
  },
  "stop_loss": {
    "support": false,
    "ratio": -0.04
  },
  "trailing_stop": {
    "support": false,
    "ratio": -0.02
  },
  "take_profit": {
    "support": false,
    "ratio": 0.07
  },
  "vars": {
    "pdi": {"func": "PLUS_DI", "params": [14], "cdl_type": 1474, "sources": ["high","low","close"], "unary": true},
    "mdi": {"func": "MINUS_DI", "params": [14], "cdl_type": 1474, "sources": ["high","low","close"], "unary": true}
  },
  "buy_systems": {
    "system1": {"alias": "di", "left": "pdi", "pt_left_market" : "KRW-BTC", "op": ">", "right": "mdi","pt_right_market" :  "KRW-BTC", "pt_tgt_market" :  "KRW-ETH"}
  },
  "buy_system_op": "system1",
  "sell_systems": {
    "system1": {"alias": "di", "left": "pdi", "pt_left_market" : "KRW-BTC", "op": "<", "right": "mdi","pt_right_market" :  "KRW-BTC", "pt_tgt_market" :  "KRW-ETH"}
  },
  "sell_system_op": "system1"
}