{
  "stgy_name": "WS_PairTrading",
  "module_name": "WinningSessionStrategy",
  "pt_exec" : true,
  "bt_start": "2020-01-01T08:59:00",
  "bt_end": "2022-03-31T08:59:00",
  "markets": ["KRW-BTC", "KRW-ETH", "KRW-XRP"],
  "cdl_type": 1440,
  "init_balance": 10000000,
  "slippage" : 0.0008,
  "bt_times" : ["08:59"],
  "vola": {
    "support": true,
    "vol_tgt": 0.04
  },
  "timeframe":{
    "support": false,
    "timeframes": ["07:59", "08:59"],
    "timegap": 1
  },
  "fixed": {
    "support": false,
    "hdge": false,
    "trade_ratio": 0.4
  },
  "weighted": {
    "support": false,
    "top_n": [0.6,0.3,0.1]
  },
  "stop_loss": {
    "support": false,
    "ratio": -0.04
  },
  "trailing_stop": {
    "support": false,
    "ratio": -0.10
  },
  "take_profit": {
    "support": false,
    "ratio": 0.07
  },
  "vars": {
    "spread1": {"func": "spread", "params": ["upbit", "KRW-BTC", "KRW-ETH", 50], "cdl_type": 1440, "sources": ["close"], "unary": true},
    "spread2": {"func": "spread", "params": ["upbit", "KRW-ETH", "KRW-BTC", 50], "cdl_type": 1440, "sources": ["close"], "unary": true}
  },
  "buy_systems": {
    "system1": {"alias": "spread1", "left": "spread1", "left_market" : "KRW-BTC", "op": ">", "right": "5",
        "right_market" : "KRW-BTC",  "tgt_market" : "KRW-ETH"},
    "system2": {"alias": "spread2", "left": "spread2", "left_market" : "KRW-ETH", "op": ">", "right": "5",
        "right_market" : "KRW-ETH", "tgt_market" : "KRW-BTC"}
  },
  "buy_system_op": "system1 or system2",
  "sell_systems": {
    "system1": {"alias": "spread1", "left": "spread", "left_market" : "KRW-BTC", "op": "<", "right": "5",
        "right_market" : "KRW-BTC",  "tgt_market" : "KRW-ETH"},
    "system2": {"alias": "spread2", "left": "spread", "left_market" : "KRW-ETH", "op": "<", "right": "5",
        "right_market" : "KRW-ETH", "tgt_market" : "KRW-BTC"}
  },
  "sell_system_op": "system1 or system2 or system3"
}